<?xml version="1.0" encoding="UTF-8"?>
<sea-surf-config xmlns:xsi="http://www.w3.org/2001/XMLSchema-instance"
	xmlns="http://www.nerdammer.it/sea-surf-config_1_0"
	xsi:schemaLocation="http://www.nerdammer.it/sea-surf-config_1_0 /Users/nicolaferraro/Workspaces/CSRF/sea-surf/src/main/resources/META-INF/sea-surf-config_1_0.xsd">

	<security-token-constraints>
		<security-token-constraint>
			<include>
				<request-type>
					<pattern>/*</pattern>
					<methods>
						<method>POST</method>
					</methods>
				</request-type>
			</include>
			
			<exclude>
				<request-type>
					<pattern>/ciccia</pattern>
				</request-type>
			</exclude>
			
		</security-token-constraint>
	</security-token-constraints>
	
	<preferences>
		<token-storage>COOKIE</token-storage>
	</preferences>

</sea-surf-config>