<?xml version="1.0" encoding="UTF-8"?>
<sea-surf-config xmlns:xsi="http://www.w3.org/2001/XMLSchema-instance"
	xmlns="http://www.nerdammer.it/sea-surf-config_1_0"
	xsi:schemaLocation="http://www.nerdammer.it/sea-surf-config_1_0 http://sea-surf.googlecode.com/files/sea-surf-config_1_0.xsd">
	
    
    <security-token-constraints>
        <security-token-constraint>
            <include>
                <request-type>
                    <pattern>/page2.jsp</pattern>
                </request-type>
            </include>
        </security-token-constraint>
        
    </security-token-constraints>
        
    <preferences>
        <token-storage>COOKIE</token-storage>
        
    </preferences>
</sea-surf-config>